{
  "rule_id": "DOMESTIC_SPECIAL_EVENT",
  "version": "1.0.0",
  "description": "Matrix class DOMESTIC_SPECIAL_EVENT (phase 03-04 exemplar)",
  "conditions": {
    "supplier_country": "AT",
    "customer_country": "AT",
    "supplier_is_business": true,
    "customer_is_business": true,
    "supplier_vat_registered": true,
    "customer_vat_registered": true,
    "supply_type": "special",
    "channel": "direct"
  },
  "effect": {
    "place_of_supply_country": "{{customer_country}}",
    "tax_liability_party": "supplier",
    "invoice_tax_rate": 20,
    "invoice_tax_shown": true,
    "reverse_charge_flag": false,
    "legal_reference": "Special rules for admission to events",
    "invoice_text_block_id": "EU_EVENT_SPECIAL"
  },
  "source_citation": [],
  "tags": [
    "special"
  ]
}
