{
  "rule_id": "THIRD_TO_THIRD_B2B_SERVICE",
  "version": "1.0.0",
  "description": "Matrix class THIRD_TO_THIRD_B2B_SERVICE (phase 03-04 exemplar)",
  "conditions": {
    "supplier_country": "US",
    "customer_country": "AE",
    "supplier_is_business": true,
    "customer_is_business": true,
    "supplier_vat_registered": true,
    "customer_vat_registered": true,
    "supply_type": "service",
    "channel": "direct"
  },
  "effect": {
    "place_of_supply_country": "{{customer_country}}",
    "tax_liability_party": "supplier",
    "invoice_tax_rate": 0,
    "invoice_tax_shown": false,
    "reverse_charge_flag": false,
    "legal_reference": "Local VAT/GST rules of involved countries",
    "invoice_text_block_id": "THIRD_TO_THIRD_GENERIC_B2B"
  },
  "source_citation": [],
  "tags": [
    "service"
  ]
}
