{
  "rule_id": "THIRD_TO_EU_B2B_SERVICE",
  "version": "1.0.0",
  "description": "Matrix class THIRD_TO_EU_B2B_SERVICE (phase 03-04 exemplar)",
  "conditions": {
    "supplier_country": "US",
    "customer_country": "AT",
    "supplier_is_business": true,
    "customer_is_business": true,
    "supplier_vat_registered": false,
    "customer_vat_registered": true,
    "supply_type": "service",
    "channel": "direct"
  },
  "effect": {
    "place_of_supply_country": "{{customer_country}}",
    "tax_liability_party": "customer",
    "invoice_tax_rate": 0,
    "invoice_tax_shown": false,
    "reverse_charge_flag": true,
    "legal_reference": "EU VAT Directive Art. 44, 196",
    "invoice_text_block_id": "EU_RC_IMPORT_SERVICE_B2B"
  },
  "source_citation": [],
  "tags": [
    "service"
  ]
}
